<?xml version="1.0" encoding="UTF-8"?>
<hmodel 
    xmlns="http://www.bridje.org/schemas/hmodel" 
    xmlns:xsi="http://www.w3.org/2001/XMLSchema-instance"
    xsi:schemaLocation="http://www.bridje.org/schemas/hmodel file:/E:/Projects/bridje-framework/bridje-data/hmodel.xsd"
    name="RModel" packageName="org.bridje.data.rmodel" 
    namespace="http://www.bridje.org/schemas/rmodel"
    customizable="true">

    <license>
Copyright 2015 Bridje Framework.
Licensed under the Apache License, Version 2.0 (the "License");
you may not use this file except in compliance with the License.
You may obtain a copy of the License at

        http://www.apache.org/licenses/LICENSE-2.0

Unless required by applicable law or agreed to in writing, software
distributed under the License is distributed on an "AS IS" BASIS,
WITHOUT WARRANTIES OR CONDITIONS OF ANY KIND, either express or implied.
See the License for the specific language governing permissions and
limitations under the License.
    </license>
    <entitys>
        <entity name="REntity">
            <list name="fields" of="RField" wrapper="false">
                <elements>
                    <element name="string" type="RStringField" />
                </elements>
            </list>
        </entity>
        <entity name="RField">
            <string name="name" access="ATTIBUTE" />
        </entity>
        <entity name="RStringField" extendsFrom="RField">
            <boolean name="trim" access="ATTIBUTE" defaultValue="false" />
        </entity>
    </entitys>
</hmodel>
